{
  "id": "pc.list-page.basic",
  "platform": "pc",
  "intent": "list-page",
  "layout": "page-shell",
  "requiredBlocks": ["neutral.filter-bar"],
  "optionalBlocks": [],
  "regions": [
    {
      "name": "body",
      "accepts": ["neutral.filter-bar", "app.result-region"],
      "required": true
    }
  ],
  "layoutRules": ["Render neutral.filter-bar before app.result-region within the body region."],
  "interactionRules": ["Let app.result-region swap between table, list, and empty-state content without moving neutral.filter-bar."],
  "recommendedTokens": ["semantic.color.action.primary"],
  "antiPatterns": ["Do not place destructive bulk actions above filters."]
}
